[
  {
    "id": "h-a",
    "char": "あ",
    "romaji": "a",
    "group": "gojuon",
    "row": "a",
    "col": "a",
    "example": {
      "word": "あめ",
      "romaji": "ame",
      "meaning": "hujan"
    }
  },
  {
    "id": "h-i",
    "char": "い",
    "romaji": "i",
    "group": "gojuon",
    "row": "a",
    "col": "i",
    "example": {
      "word": "いぬ",
      "romaji": "inu",
      "meaning": "anjing"
    }
  },
  {
    "id": "h-u",
    "char": "う",
    "romaji": "u",
    "group": "gojuon",
    "row": "a",
    "col": "u",
    "example": {
      "word": "うみ",
      "romaji": "umi",
      "meaning": "laut"
    }
  },
  {
    "id": "h-e",
    "char": "え",
    "romaji": "e",
    "group": "gojuon",
    "row": "a",
    "col": "e",
    "example": {
      "word": "えき",
      "romaji": "eki",
      "meaning": "stasiun"
    }
  },
  {
    "id": "h-o",
    "char": "お",
    "romaji": "o",
    "group": "gojuon",
    "row": "a",
    "col": "o",
    "example": {
      "word": "おちゃ",
      "romaji": "ocha",
      "meaning": "teh"
    }
  },
  {
    "id": "h-ka",
    "char": "か",
    "romaji": "ka",
    "group": "gojuon",
    "row": "k",
    "col": "a",
    "example": {
      "word": "かさ",
      "romaji": "kasa",
      "meaning": "payung"
    }
  },
  {
    "id": "h-ki",
    "char": "き",
    "romaji": "ki",
    "group": "gojuon",
    "row": "k",
    "col": "i",
    "example": {
      "word": "き",
      "romaji": "ki",
      "meaning": "pohon"
    }
  },
  {
    "id": "h-ku",
    "char": "く",
    "romaji": "ku",
    "group": "gojuon",
    "row": "k",
    "col": "u",
    "example": {
      "word": "くつ",
      "romaji": "kutsu",
      "meaning": "sepatu"
    }
  },
  {
    "id": "h-ke",
    "char": "け",
    "romaji": "ke",
    "group": "gojuon",
    "row": "k",
    "col": "e",
    "example": {
      "word": "けしゴム",
      "romaji": "keshigomu",
      "meaning": "penghapus"
    }
  },
  {
    "id": "h-ko",
    "char": "こ",
    "romaji": "ko",
    "group": "gojuon",
    "row": "k",
    "col": "o",
    "example": {
      "word": "こえ",
      "romaji": "koe",
      "meaning": "suara"
    }
  },
  {
    "id": "h-sa",
    "char": "さ",
    "romaji": "sa",
    "group": "gojuon",
    "row": "s",
    "col": "a",
    "example": {
      "word": "さかな",
      "romaji": "sakana",
      "meaning": "ikan"
    }
  },
  {
    "id": "h-shi",
    "char": "し",
    "romaji": "shi",
    "group": "gojuon",
    "row": "s",
    "col": "i",
    "example": {
      "word": "しお",
      "romaji": "shio",
      "meaning": "garam"
    }
  },
  {
    "id": "h-su",
    "char": "す",
    "romaji": "su",
    "group": "gojuon",
    "row": "s",
    "col": "u",
    "example": {
      "word": "すし",
      "romaji": "sushi",
      "meaning": "sushi"
    }
  },
  {
    "id": "h-se",
    "char": "せ",
    "romaji": "se",
    "group": "gojuon",
    "row": "s",
    "col": "e",
    "example": {
      "word": "せなか",
      "romaji": "senaka",
      "meaning": "punggung"
    }
  },
  {
    "id": "h-so",
    "char": "そ",
    "romaji": "so",
    "group": "gojuon",
    "row": "s",
    "col": "o",
    "example": {
      "word": "そら",
      "romaji": "sora",
      "meaning": "langit"
    }
  },
  {
    "id": "h-ta",
    "char": "た",
    "romaji": "ta",
    "group": "gojuon",
    "row": "t",
    "col": "a",
    "example": {
      "word": "たまご",
      "romaji": "tamago",
      "meaning": "telur"
    }
  },
  {
    "id": "h-chi",
    "char": "ち",
    "romaji": "chi",
    "group": "gojuon",
    "row": "t",
    "col": "i",
    "example": {
      "word": "ちず",
      "romaji": "chizu",
      "meaning": "peta"
    }
  },
  {
    "id": "h-tsu",
    "char": "つ",
    "romaji": "tsu",
    "group": "gojuon",
    "row": "t",
    "col": "u",
    "example": {
      "word": "つくえ",
      "romaji": "tsukue",
      "meaning": "meja"
    }
  },
  {
    "id": "h-te",
    "char": "て",
    "romaji": "te",
    "group": "gojuon",
    "row": "t",
    "col": "e",
    "example": {
      "word": "てがみ",
      "romaji": "tegami",
      "meaning": "surat"
    }
  },
  {
    "id": "h-to",
    "char": "と",
    "romaji": "to",
    "group": "gojuon",
    "row": "t",
    "col": "o",
    "example": {
      "word": "とり",
      "romaji": "tori",
      "meaning": "burung"
    }
  },
  {
    "id": "h-na",
    "char": "な",
    "romaji": "na",
    "group": "gojuon",
    "row": "n",
    "col": "a",
    "example": {
      "word": "なつ",
      "romaji": "natsu",
      "meaning": "musim panas"
    }
  },
  {
    "id": "h-ni",
    "char": "に",
    "romaji": "ni",
    "group": "gojuon",
    "row": "n",
    "col": "i",
    "example": {
      "word": "にく",
      "romaji": "niku",
      "meaning": "daging"
    }
  },
  {
    "id": "h-nu",
    "char": "ぬ",
    "romaji": "nu",
    "group": "gojuon",
    "row": "n",
    "col": "u",
    "example": {
      "word": "ぬの",
      "romaji": "nuno",
      "meaning": "kain"
    }
  },
  {
    "id": "h-ne",
    "char": "ね",
    "romaji": "ne",
    "group": "gojuon",
    "row": "n",
    "col": "e",
    "example": {
      "word": "ねこ",
      "romaji": "neko",
      "meaning": "kucing"
    }
  },
  {
    "id": "h-no",
    "char": "の",
    "romaji": "no",
    "group": "gojuon",
    "row": "n",
    "col": "o",
    "example": {
      "word": "のり",
      "romaji": "nori",
      "meaning": "rumput laut kering"
    }
  },
  {
    "id": "h-ha",
    "char": "は",
    "romaji": "ha",
    "group": "gojuon",
    "row": "h",
    "col": "a",
    "example": {
      "word": "はな",
      "romaji": "hana",
      "meaning": "bunga"
    }
  },
  {
    "id": "h-hi",
    "char": "ひ",
    "romaji": "hi",
    "group": "gojuon",
    "row": "h",
    "col": "i",
    "example": {
      "word": "ひと",
      "romaji": "hito",
      "meaning": "orang"
    }
  },
  {
    "id": "h-fu",
    "char": "ふ",
    "romaji": "fu",
    "group": "gojuon",
    "row": "h",
    "col": "u",
    "example": {
      "word": "ふね",
      "romaji": "fune",
      "meaning": "kapal"
    }
  },
  {
    "id": "h-he",
    "char": "へ",
    "romaji": "he",
    "group": "gojuon",
    "row": "h",
    "col": "e",
    "example": {
      "word": "へや",
      "romaji": "heya",
      "meaning": "kamar"
    }
  },
  {
    "id": "h-ho",
    "char": "ほ",
    "romaji": "ho",
    "group": "gojuon",
    "row": "h",
    "col": "o",
    "example": {
      "word": "ほし",
      "romaji": "hoshi",
      "meaning": "bintang"
    }
  },
  {
    "id": "h-ma",
    "char": "ま",
    "romaji": "ma",
    "group": "gojuon",
    "row": "m",
    "col": "a",
    "example": {
      "word": "まど",
      "romaji": "mado",
      "meaning": "jendela"
    }
  },
  {
    "id": "h-mi",
    "char": "み",
    "romaji": "mi",
    "group": "gojuon",
    "row": "m",
    "col": "i",
    "example": {
      "word": "みず",
      "romaji": "mizu",
      "meaning": "air"
    }
  },
  {
    "id": "h-mu",
    "char": "む",
    "romaji": "mu",
    "group": "gojuon",
    "row": "m",
    "col": "u",
    "example": {
      "word": "むし",
      "romaji": "mushi",
      "meaning": "serangga"
    }
  },
  {
    "id": "h-me",
    "char": "め",
    "romaji": "me",
    "group": "gojuon",
    "row": "m",
    "col": "e",
    "example": {
      "word": "めがね",
      "romaji": "megane",
      "meaning": "kacamata"
    }
  },
  {
    "id": "h-mo",
    "char": "も",
    "romaji": "mo",
    "group": "gojuon",
    "row": "m",
    "col": "o",
    "example": {
      "word": "もも",
      "romaji": "momo",
      "meaning": "persik"
    }
  },
  {
    "id": "h-ya",
    "char": "や",
    "romaji": "ya",
    "group": "gojuon",
    "row": "y",
    "col": "a",
    "example": {
      "word": "やま",
      "romaji": "yama",
      "meaning": "gunung"
    }
  },
  {
    "id": "h-yu",
    "char": "ゆ",
    "romaji": "yu",
    "group": "gojuon",
    "row": "y",
    "col": "u",
    "example": {
      "word": "ゆき",
      "romaji": "yuki",
      "meaning": "salju"
    }
  },
  {
    "id": "h-yo",
    "char": "よ",
    "romaji": "yo",
    "group": "gojuon",
    "row": "y",
    "col": "o",
    "example": {
      "word": "よる",
      "romaji": "yoru",
      "meaning": "malam"
    }
  },
  {
    "id": "h-ra",
    "char": "ら",
    "romaji": "ra",
    "group": "gojuon",
    "row": "r",
    "col": "a",
    "example": {
      "word": "らくだ",
      "romaji": "rakuda",
      "meaning": "unta"
    }
  },
  {
    "id": "h-ri",
    "char": "り",
    "romaji": "ri",
    "group": "gojuon",
    "row": "r",
    "col": "i",
    "example": {
      "word": "りんご",
      "romaji": "ringo",
      "meaning": "apel"
    }
  },
  {
    "id": "h-ru",
    "char": "る",
    "romaji": "ru",
    "group": "gojuon",
    "row": "r",
    "col": "u",
    "example": {
      "word": "るす",
      "romaji": "rusu",
      "meaning": "tidak ada di rumah"
    }
  },
  {
    "id": "h-re",
    "char": "れ",
    "romaji": "re",
    "group": "gojuon",
    "row": "r",
    "col": "e",
    "example": {
      "word": "れいぞうこ",
      "romaji": "reizouko",
      "meaning": "kulkas"
    }
  },
  {
    "id": "h-ro",
    "char": "ろ",
    "romaji": "ro",
    "group": "gojuon",
    "row": "r",
    "col": "o",
    "example": {
      "word": "ろうそく",
      "romaji": "rousoku",
      "meaning": "lilin"
    }
  },
  {
    "id": "h-wa",
    "char": "わ",
    "romaji": "wa",
    "group": "gojuon",
    "row": "w",
    "col": "a",
    "example": {
      "word": "わたし",
      "romaji": "watashi",
      "meaning": "saya"
    }
  },
  {
    "id": "h-wo",
    "char": "を",
    "romaji": "wo",
    "group": "gojuon",
    "row": "w",
    "col": "o",
    "alt": [
      "o"
    ],
    "example": {
      "word": "ほん を よむ",
      "romaji": "hon o yomu",
      "meaning": "membaca buku (を = partikel objek)"
    }
  },
  {
    "id": "h-n",
    "char": "ん",
    "romaji": "n",
    "group": "gojuon",
    "row": "nn",
    "col": "n",
    "example": {
      "word": "ほん",
      "romaji": "hon",
      "meaning": "buku"
    }
  },
  {
    "id": "h-ga",
    "char": "が",
    "romaji": "ga",
    "group": "dakuten",
    "row": "g",
    "col": "a",
    "example": {